,title,view_num,url
118,Kimura attack from side control with the option to arm bar - Andre Galvao,240000.0,https://www.youtube.com/watch?v=S66HNbNkso8
150,HALF GUARD PASSING SECRET!!!! Atos Jiu Jitsu HQ Techniques,130000.0,https://www.youtube.com/watch?v=pv-pJarhbro
154,Atos Jiu Jitsu HQ sparring: Andre Galvao & Erberth Santos,110000.0,https://www.youtube.com/watch?v=AG8TS0w_lEo
160,Arm drag from the closed guard,94000.0,https://www.youtube.com/watch?v=nnzXF5xntE0
148,MUST SEE X GUARD SWEEP!!!  Professor Andre Galvao,92000.0,https://www.youtube.com/watch?v=Wa_5-mwGbM4
146,Andre Galvao - Saída da Guarda Lapela - Worm Guard MUST SEE!!!,83000.0,https://www.youtube.com/watch?v=2n7cbMvTUD0
109,Arm bar from closed guard to triangle - Andre Galvao,75000.0,https://www.youtube.com/watch?v=tZa73s0RmAY
86,Effective Way to Open the Closed Guard by Andre Galvao,70000.0,https://www.youtube.com/watch?v=hvccwa2DIsA
166,Inverted De La Riva Back Take,61000.0,https://www.youtube.com/watch?v=RlbwUMDdddU
145,Andre Galvao - Atos jiu jitsu BACK TAKE!!! MUST SEE!!,58000.0,https://www.youtube.com/watch?v=HjVi4pl77tI
80,Basic guard passes with Prof. Andre Galvao,56000.0,https://www.youtube.com/watch?v=O1Vs8uejCz0
138,X guard to triangle with the option to arm bar - Andre Galvao,54000.0,https://www.youtube.com/watch?v=JwA1HUVmIhM
42,The most effective way to escape a triangle choke by Andre Galvao,52000.0,https://www.youtube.com/watch?v=YZENtdUlpmg
159,Rolando Samson Black belt promotion,50000.0,https://www.youtube.com/watch?v=5rO3T2qyQs0
92,Over under pass trapping opponent's leg - Andre Galvao,47000.0,https://www.youtube.com/watch?v=b8sco6ZtkCo
149,"The ""HULK SMASH PASS!!"" Atos Jiu Jitsu HQ",47000.0,https://www.youtube.com/watch?v=S6dm9M9TmTY
108,Demian Maia's Seminar,44000.0,https://www.youtube.com/watch?v=tZjV9iaz7lc
113,Secret for a DEADLY REAR NAKED CHOKE - MATA LEĀO - Andre Galvao,42000.0,https://www.youtube.com/watch?v=erP2JxvVn-E
32,Solo Drill Circuit Training for Jiu-Jitsu,40000.0,https://www.youtube.com/watch?v=hxRxkAz3gfo
102,Basic and modified hip bump sweep from closed guard + arm bar from mount position - Andre Galvao,39000.0,https://www.youtube.com/watch?v=dKGgZaEcouY
158,BLACK BELT PROMOTION of Young Jae Lee,36000.0,https://www.youtube.com/watch?v=S8fZjprClVw
117,G.I. Joe pass with variation professor - Andre Galvao,35000.0,https://www.youtube.com/watch?v=J1JKYa4LVgg
116,Berimbolo from side smash to back take - Andre Galvao,35000.0,https://www.youtube.com/watch?v=niHFphkAnCY
120,3 different variations of back taking from the same position - Andre Galvao.,34000.0,https://www.youtube.com/watch?v=nE6DqdwEqwg
106,Amazing Stack Pass Defense by Prof. Andre Galvao,33000.0,https://www.youtube.com/watch?v=gbe-aA6WAAE
93,Kaynan Duarte ensina RASPAGEM usada na final do mundial faixa preta 2019,33000.0,https://www.youtube.com/watch?v=yfEHi6VF8Nw
114,Stack Pass Drills + Details - Andre Galvao,33000.0,https://www.youtube.com/watch?v=Bsc4528OSiU
89,Atos Jiu Jitsu HQ Sparring - Professor Andre Galvao vs Kade Ruotolo,32000.0,https://www.youtube.com/watch?v=SCsUv1z4gqg
127,De la Riva + berimbolo to mount professor - Michael Liera,30000.0,https://www.youtube.com/watch?v=fWOYcZcgfuY
9,How to Apply an Arm Bar From Half Guard - Andre Galvao,30000.0,https://www.youtube.com/watch?v=CY9HvkY6Y6E
163,Monkey Tail,29000.0,https://www.youtube.com/watch?v=B3DHfk3MawY
87,"Andre Galvao 2019 ADCC: ""The King's Glory""",29000.0,https://www.youtube.com/watch?v=HAmzlcSXoBw
147,Andre Galvao - SUPERMAN back take!! Atos online academy,28000.0,https://www.youtube.com/watch?v=k_uoMyyJNQU
121,Setting up the monoplata from long step - Andre Galvao,25000.0,https://www.youtube.com/watch?v=WjK9UJbrzW0
139,Collar choke from the back - Andre Galvao,25000.0,https://www.youtube.com/watch?v=okqrGs8VMpg
88,HALF GUARD PASS by Prof. Andre Galvao,25000.0,https://www.youtube.com/watch?v=CJVEwpOrpRo
101,Shoulder trap hooks guard sweep - Andre Galvao,25000.0,https://www.youtube.com/watch?v=sSVTdlcYIHs
142,Andre Galvao - sweeping from the x guard,25000.0,https://www.youtube.com/watch?v=8xOq1cUJyDw
156,Pro Tips with Professor Andre Galvao: how to improve in BJJ faster!!,24000.0,https://www.youtube.com/watch?v=0pOhMqvZ5F0
83,Never Get Tap Again - Arm Lock Defense by Andre Galvao,23000.0,https://www.youtube.com/watch?v=KJCYwSIsbSE
136,Back take from the 50 50 with choke - Andre Galvao,23000.0,https://www.youtube.com/watch?v=obp9bimdo50
115,Berimbolo from DLR guard to back take - Andre Galvao,23000.0,https://www.youtube.com/watch?v=bYJK6e6Iywo
14,Atos Online - Train Smarter. Study More.,23000.0,https://www.youtube.com/watch?v=NhR3RpuGlrM
133,Passing from Leg Drag position - Kade Ruotolo,23000.0,https://www.youtube.com/watch?v=SubxQHfEX54
144,MIKE CARBULLIDO Atos Jiu Jitsu BLACK BELT!!,22000.0,https://www.youtube.com/watch?v=0KCVEe3ZUTg
107,Basic DLR guard to crab ride back take and clock chock - Andre Galvao,21000.0,https://www.youtube.com/watch?v=U5cY6NFd_WI
164,Inverted de la riva back take option: 3,21000.0,https://www.youtube.com/watch?v=MUGGW8SltAY
135,Passagem da DLR invertida - Jonnatas Gracie,19000.0,https://www.youtube.com/watch?v=PNWo0isTPz4
162,2017 Atos Jiu Jitsu HQ Kids Pans HIGHLIGHT,19000.0,https://www.youtube.com/watch?v=-OVQy_DMwPU
111,Pretzelbolo - Andre Galvao,19000.0,https://www.youtube.com/watch?v=BajYgdx7QS0
130,Andre Galvao - Pro Tip: how often should a competitor train?,19000.0,https://www.youtube.com/watch?v=7NhRWjWnous
157,black belt promotion of Michael Perez form Prof. Andre Galvao,17000.0,https://www.youtube.com/watch?v=v_V3n9Am9vE
84,Easy Sweep From DLR Guard to X Guard Using The Lasso + Windshield Wiper Pass & Back Attack,17000.0,https://www.youtube.com/watch?v=FEVOY546Ads
143,Andre Galvao - Finishing the toe hold,16000.0,https://www.youtube.com/watch?v=svew1IBxgK4
90,Scissors sweep using the lapel + arm bar from mount position - Andre Galvao,16000.0,https://www.youtube.com/watch?v=kJMklCpiH0o
151,Jonnatas Gracie - Passagem de guarda lasso,16000.0,https://www.youtube.com/watch?v=eB4V5cOemNg
70,16 years old Purple Belts after training Jiu Jitsu for almost 14 years,15000.0,https://www.youtube.com/watch?v=Oao_d9qrD_I
72,Transition from side control to arm bar - Andre Galvao,15000.0,https://www.youtube.com/watch?v=mLMcpBplM8k
77,"Concepts, Tips  Q&A by Jiu Jitsu World Champion Andre Galvao: Basic guard retention against leg drag",15000.0,https://www.youtube.com/watch?v=z5QrkJwgAdw
65,"Basic Side Control Concept, Details & Attacks - Mouse Trap Americana + Armbar WWW.ATOSBJJONLINE.COM",15000.0,https://www.youtube.com/watch?v=UlvR5nR_9VA
141,Andre Galvao - ADCC 2011 Highlight,15000.0,https://www.youtube.com/watch?v=yzNI9rI4Hk0
94,Squid guard sweep from DLR + knee bar - Ronaldo Jr.,14000.0,https://www.youtube.com/watch?v=xkP4wm9u63c
112,Back take control to cartwheel crab ride leg drag - Andre Galvao,14000.0,https://www.youtube.com/watch?v=hVJsaTliVL4
137,Raspagem da guarda fechada com a pegada cruzada - Kaynan Duarte,14000.0,https://www.youtube.com/watch?v=FRVAHokBsnc
67,"The best way to mount from side control - white to black belt - Concepts, Details & Submissions",14000.0,https://www.youtube.com/watch?v=dI44-xSintY
85,Atos Jiujitsu HQ Sparring: Lucas Barbosa Vs Jonnatas Gracie - 2017 Worlds Camp,14000.0,https://www.youtube.com/watch?v=uQEiv105EbY
155,Pro Tips with Professor Andre Galvao: how many days per week should I train?,13000.0,https://www.youtube.com/watch?v=j73YL45U0Jk
165,Inverted de la riva back take Option:2,12000.0,https://www.youtube.com/watch?v=WHswks9DFow
129,Andre Galvao - Pro Tip: How can you improve faster in jiu jitsu?,11000.0,https://www.youtube.com/watch?v=w-3WtkN1aPo
56,Knee tap pass & knee cut pass - Andre Galvao,11000.0,https://www.youtube.com/watch?v=Q5fj0SKvnM8
75,Basic kimura system from closed guard - Andre Galvao,11000.0,https://www.youtube.com/watch?v=5nDIxRMdll4
128,Sweep from X guard - Jonnatas Gracie,11000.0,https://www.youtube.com/watch?v=ujdM3ADOrLI
132,Passing from De la Riva guard - Tye Ruotolo,11000.0,https://www.youtube.com/watch?v=gRygomLYT8U
134,Arm lock partindo da 50 50 - Andy Murasaki,10000.0,https://www.youtube.com/watch?v=tkK2GiJA30I
98,Passing lasso guard - Gustavo Batista,10000.0,https://www.youtube.com/watch?v=tjhNLmaGKRI
43,Back take concepts - Andre Galvao,10000.0,https://www.youtube.com/watch?v=aOPpINAXLaU
29,The most simple and effective mount escape - Andre Galvao,10000.0,https://www.youtube.com/watch?v=VbYueGpaslQ
119,Black belt promotion of Dominique Bell,10000.0,https://www.youtube.com/watch?v=mV1S3Z92arg
110,Pretzelbolo guard pass from one leg X when opponent undertook the leg - Andre Galvao,10000.0,https://www.youtube.com/watch?v=3x538KLyBhE
68,Back take escapes - Andre Galvao,10000.0,https://www.youtube.com/watch?v=EF8swUGRT5U
16,Easy Way to Open the Closed Guard - Andre Galvao,10000.0,https://www.youtube.com/watch?v=nsOOTaHCvJI
104,Half guard pass using the lapel to mount + collar choke - Mike Carbullido,9700.0,https://www.youtube.com/watch?v=yg5mLQtJF3s
59,Collar drag variations by Andre Galvao WWW.ATOSBJJONLINE.COM,9600.0,https://www.youtube.com/watch?v=3QkQoPa8rpw
17,Closed Guard Attacks & Basic Mount Escape Details - Andre Galvao,9200.0,https://www.youtube.com/watch?v=IsT0IVDNbUY
152,Pro Tips with Professor Andre Galvao: how to MEMORIZE all your techniques!!!!!,8300.0,https://www.youtube.com/watch?v=GBLeq23gYJk
11,Chair Guard Sweep - Andre Galvao,8200.0,https://www.youtube.com/watch?v=HmjztwF6IpY
97,Newest Atos HQ Black Belt Jonnatas Gracie,8100.0,https://www.youtube.com/watch?v=mdL1rMH2N9M
48,Leg drag concepts to back take - Prof. Andre Galvao,8100.0,https://www.youtube.com/watch?v=DoCX19KDal4
27,Plyometrics Training Workout - Andre Galvao | WWW.ATOSBJJONLINE.COM,7600.0,https://www.youtube.com/watch?v=yN1t4uVpzJA
124,Raspagem da guarda laço - Rafael Vasconcelos,7500.0,https://www.youtube.com/watch?v=8rqbEgLNTGY
18,How to Escape Back Control - Andre Galvao,7200.0,https://www.youtube.com/watch?v=PjztsyjHQ0k
79,Atos Online Tech Teaser - Windshield Wiper Pass to Leg Drag - Rolando Samson,6900.0,https://www.youtube.com/watch?v=TbEvlO8NIgM
36,Atos live,6500.0,https://www.youtube.com/watch?v=7ybBorni4rA
105,Jiu-Jitsu Transformation,6500.0,https://www.youtube.com/watch?v=skyB3-U1Sj0
54,Guard pull Counters and pass options - Andre Galvao,6500.0,https://www.youtube.com/watch?v=_1xQX6qfNYU
96,Ronaldo Jr. promoted to black belt by Prof. Andre Galvao,6300.0,https://www.youtube.com/watch?v=2QtLsYkz2go
153,Pro Tips with Professor Andre Galvao: how to imoprove in Jiu Jitsu FAST!!!,6200.0,https://www.youtube.com/watch?v=tsPBm43bq5E
33,Reverse half guard escape - Andre Galvao,6100.0,https://www.youtube.com/watch?v=-Jb4wDymHQE
26,Mount Position Breakdown by Andre Galvao - Secrets to Survive & Escape  BASICS TO FUNDAMENTALS LEVEL,6100.0,https://www.youtube.com/watch?v=luPhbVPoQ1E
103,Atos Online Breakdown - Kaynan Duarte - Pretzelbolo to Back at Kasai Pro 5,6100.0,https://www.youtube.com/watch?v=KkrYxnr3cMs
168,Angelica Galvao & Mackenzie Dern Seminar,6000.0,https://www.youtube.com/watch?v=G2wfHvq873A
51,Cross step pass - Rolando Samson,6000.0,https://www.youtube.com/watch?v=2c_y9Q_LM20
6,How to Apply a Triangle from Side Control - Andre Galvao,5900.0,https://www.youtube.com/watch?v=7L5CsdH33gg
21,Powerful pressure knee cut pass - Andre Galvao,5700.0,https://www.youtube.com/watch?v=u8NgOSo9tic
15,Old School Closed Guard Pass - Andre Galvao,5600.0,https://www.youtube.com/watch?v=NCp6xctn1lQ
125,Raspagem com ataque de omoplata - Pablo Mantovani,5500.0,https://www.youtube.com/watch?v=lLrs3I3AiJM
82,Atos Online Tech Teaser - DLR Spider Sweep - Kaynan Duarte,5400.0,https://www.youtube.com/watch?v=yogR3YPJCvc
78,Atos Online Tech Teaser - Two Guillotine Defenses - Prof. Andre Galvao,5300.0,https://www.youtube.com/watch?v=ciQssBVo6dg
39,One Leg X defense - Dominique Bell,5200.0,https://www.youtube.com/watch?v=dJ1dh5I-7sA
140,Mario Jussiani black belt Promotion by Prof Galvao,5200.0,https://www.youtube.com/watch?v=FJf4N-6xHPc
64,Atos Online Tech Teaser - Rolling Side Control Escape - Prof. Andre Galvao,5100.0,https://www.youtube.com/watch?v=NTla7m0Q8eg
13,Back Take From DLR Lasso Guard - Andre Galvao,5100.0,https://www.youtube.com/watch?v=jkdLtUbT7tw
35,Jiu Jiutsu Drills WWW.ATOSBJJONLINE.COM,5000.0,https://www.youtube.com/watch?v=6Pu84O4xd4Q
4,Waiter Sweep from DLR guard - Andre Galvao,5000.0,https://www.youtube.com/watch?v=37dCDlxk4Eo
81,Atos Online Tech Teaser - Long Step DLR Pass - Prof. Andre Galvao,4900.0,https://www.youtube.com/watch?v=Q_6A0T930so
31,Single leg X to Honey Hole Heel Hook - Andre Galvao,4900.0,https://www.youtube.com/watch?v=ae-RhAMwdeI
22,Modified toreando guard pass - Andre Galvao,4900.0,https://www.youtube.com/watch?v=S65D0wxPZ7c
40,Atos Online Tech Teaser - Pee Dog Pass with Four Submissions - Prof. Andre Galvao,4900.0,https://www.youtube.com/watch?v=N2i0M8l4uZA
126,Arm bar partindo do triângulo - Ronaldo Jr.,4800.0,https://www.youtube.com/watch?v=nfsNFIyuTws
24,Spider guard lasso control to omoplata - Andre Galvao,4700.0,https://www.youtube.com/watch?v=WdN8molUN7E
19,"Passing ""2 on 1"" guard professor - Andre Galvao",4600.0,https://www.youtube.com/watch?v=_ZL6QsMAAJw
74,Atos Online Tech Teaser - DLR to Honey Hole to Sweep to Pass - Nisar Loynab,4600.0,https://www.youtube.com/watch?v=tmkIxde6Dio
30,Split pass from DLR guard to side control + wrist lock - Andre Galvao,4500.0,https://www.youtube.com/watch?v=LnVr3HEM30c
23,Concepts and details from one leg X - Andre Galvao,4500.0,https://www.youtube.com/watch?v=t7U31htkuOI
45,Squid Guard Pass Using the Side Smash by Andre Galvao - Concepts & Details,4400.0,https://www.youtube.com/watch?v=HOsz79Ev5Gg
123,Controle da pegada de costas - Kaynan Duarte,4400.0,https://www.youtube.com/watch?v=lwF-hwnGKBc
34,Andre Galvao - Live stream,4400.0,https://www.youtube.com/watch?v=RAs1tsS6U1E
95,Atos Online In Action - Flow Drill: Passing and Guard Retention,4300.0,https://www.youtube.com/watch?v=zI9h0-gkVY8
61,Triangle from 2-on-1 guard - Mike Carbullido,4200.0,https://www.youtube.com/watch?v=mqBLasCrzQU
57,Single leg to double leg takedown - Fred Leavy,4100.0,https://www.youtube.com/watch?v=IUTzYwJ3Zro
63,Galaxy guard professor - Dominique Bell,4100.0,https://www.youtube.com/watch?v=1HSb9QSuI_k
69,Atos Online Tech Teaser - DLR Side Smash Pass - Andy Murasaki,3800.0,https://www.youtube.com/watch?v=VyP7wfCCm_Q
167,Atos Jiujitsu 2015 Gala Highlight,3800.0,https://www.youtube.com/watch?v=M2c5zENtrI0
76,Atos Online Tech Teaser - Four Reverse DLR Pass Drills - Prof. Andre Galvao,3700.0,https://www.youtube.com/watch?v=b-GRCwQUpew
131,Andre Galvao Work Shop at JJ2LEAGUE - Long Beach Ca,3600.0,https://www.youtube.com/watch?v=WW0B0sgkCq4
122,Atos Jiu-jitsu Hq - 8-12 Years Old Kids Class,3500.0,https://www.youtube.com/watch?v=aah9a92QQzA
100,Mike Anderson black belt Promotion by Prof Andre Galvao,3500.0,https://www.youtube.com/watch?v=WoBOJfQpXt0
5,Atos Vlog - Inside our Competition Class,3400.0,https://www.youtube.com/watch?v=pg1Y-rAmTMY
10,Ronaldo Jr. Speaks about his upcoming fight with Gordon Ryan on July 31st,3300.0,https://www.youtube.com/watch?v=QumLpDwsJxM
47,Atos Online Tech Teaser - Worm Guard Options - Prof. Andre Galvao,3200.0,https://www.youtube.com/watch?v=ha0qiG_-r3w
7,Straight Elbow Lock from Side Control - Andre Galvao,3100.0,https://www.youtube.com/watch?v=z_kOTI2vSYY
161,Atos Open 2017,3000.0,https://www.youtube.com/watch?v=f6RD18LAYdo
28,Submission combo arm trap - Ronaldo Jr.,3000.0,https://www.youtube.com/watch?v=Fjj8BAgCb5A
52,9am fundamental class with Rolando Samson,3000.0,https://www.youtube.com/watch?v=fkX1pIpxCyY
99,Atos Online In Action - Sparring with Prof Andre Galvao and Mike Perez,3000.0,https://www.youtube.com/watch?v=8TPfKumzc8w
66,Atos Online Tech Teaser - Kimura from Half Guard - Prof. Andre Galvao,3000.0,https://www.youtube.com/watch?v=sy8fEHgwdbc
1,Arm Drag to Back Take - Andre Galvao,2900.0,https://www.youtube.com/watch?v=A9ZutrGFUJE
44,Atos Online Tech Teaser - Super Simple Squid Guard Pass - Prof. Andre Galvao,2800.0,https://www.youtube.com/watch?v=Jnh1v9nIPpU
91,Atos Online Academy - Join Now!,2700.0,https://www.youtube.com/watch?v=t4hz2OJZbko
20,4/11 trap from hooks guard - Andre Galvao,2700.0,https://www.youtube.com/watch?v=u4ouUOB7VbM
73,Atos Online Tech Teaser - Squid Guard Pass - Prof. Andre Galvao,2600.0,https://www.youtube.com/watch?v=f_0S5TlodgY
53,Atos Online Tech Teaser - Cross Step Pass - Rolando Samson,2600.0,https://www.youtube.com/watch?v=Ml9SiAIIdNA
25,5x5 Mission Ready - Our Mission is to Bring You Home Alive,2600.0,https://www.youtube.com/watch?v=DIiZGz1Rmlk
37,A maneira mais eficaz de defender as costas - Andre Galvao,2500.0,https://www.youtube.com/watch?v=4PdJ9oqwVI0
169,Team Atos Jiu Jitsu 2016 Kids Pan Ams,2400.0,https://www.youtube.com/watch?v=SgxF0affTVo
46,Atos Online Tech Teaser - Basic Knee Slice - Rafael Vasconcelos,2400.0,https://www.youtube.com/watch?v=YaH7dM6HXjM
62,Atos Online Tech Teaser - DLR Guard Pull to 2-on-1 Triangle Arm Bar - Mike Carbullido,2300.0,https://www.youtube.com/watch?v=WZDOWU_dMlE
60,Atos Online Tech Teaser - 2 Variations of the Stack Pass - Prof. Andre Galvao,2200.0,https://www.youtube.com/watch?v=SG-TujC34W4
41,Atos Online Tech Teaser - Double Under Pass Defense to Triangle - Mike Carbullido,2200.0,https://www.youtube.com/watch?v=pN8N-efR54g
71,Train Smarter. Study More. With the Atos Online Academy!,2100.0,https://www.youtube.com/watch?v=7yP6ERJMbug
55,Atos Online Tech Teaser - Guard Pull Counters and Pass Options - Prof. Andre Galvao,2100.0,https://www.youtube.com/watch?v=VXdDegKgNCA
58,Atos Online Tech Teaser - Single and Double Leg Takedown - Fred Leavy,1900.0,https://www.youtube.com/watch?v=DWXnuSb6wv0
49,Kids Training Camp Highlight,1800.0,https://www.youtube.com/watch?v=87hI8sXDnmM
50,"Friday, the 7th of February positional training",1700.0,https://www.youtube.com/watch?v=2DMvavmU-Eg
12,Atos Athlete Spotlight - Caleb,1700.0,https://www.youtube.com/watch?v=KRJh7AvKgZ4
3,Galvao Interviews Black Belt Nisar Loynab,1200.0,https://www.youtube.com/watch?v=A3-S70LUIpI
38,Atos HQ Pan Kids Highlight,1000.0,https://www.youtube.com/watch?v=YbBw7yLAM0k
0,Galvao interviews Ruotolo Brothers,854.0,https://www.youtube.com/watch?v=ybRngX7AwOI
2,Galvao Interviews Luiza Monteiro,752.0,https://www.youtube.com/watch?v=ZfECUwvkN_U
8,Squid Guard Sweep to Knee Bar - Andre Galvao,585.0,https://www.youtube.com/watch?v=TUux1KNyJtY
