,title,view_num,url
224,How To Takedown A Bigger Opponent by Henry Cejudo,520000.0,https://www.youtube.com/watch?v=m0jQ8ae8_g8
178,How To Do The Perfect Armbar by John Danaher,470000.0,https://www.youtube.com/watch?v=GshEzcqlUbY
134,The 3 Most Important Jiu Jitsu Techniques For A BJJ White Belt by John Danaher,410000.0,https://www.youtube.com/watch?v=QBqwipFt0Ww
162,How To Do The Perfect BJJ Side Control Escape by John Danaher,350000.0,https://www.youtube.com/watch?v=cuXq-k__9lQ
206,How To Do The Perfect Triangle Choke Even If You Have Short Legs by John Danaher,320000.0,https://www.youtube.com/watch?v=LDE0fkzZT6I
236,How To Do The Perfect Kimura From Side Control by John Danaher,270000.0,https://www.youtube.com/watch?v=p-6lmaseoGI
155,How To Do The Perfect BJJ Mount Escape by John Danaher,230000.0,https://www.youtube.com/watch?v=EMEueexp9zU
130,How To Build The Perfect Half Guard Game by John Danaher,220000.0,https://www.youtube.com/watch?v=E8x1Cva8hJ8
163,"3 Submissions Every BJJ Black Belt Should Know by Craig Jones, Bernardo Faria & John Danaher",210000.0,https://www.youtube.com/watch?v=u9BE8kY123A
257,The High Elbow Guillotine by John Danaher,200000.0,https://www.youtube.com/watch?v=XCiRr7TW2bk
67,"The Most Deadly Jiu Jitsu Wrist Locks For The Street (Self Defense) by Márcio ""Macarrão"" Stambowsky",180000.0,https://www.youtube.com/watch?v=OdI42Hvqp6M
194,Gordon Ryan Explains His Guard Passing System,160000.0,https://www.youtube.com/watch?v=RvgT17Xri5g
65,5 Tips To Pass ANY Guard by John Danaher,150000.0,https://www.youtube.com/watch?v=ODuQCA88oY4
63,Mastering The Rubber Guard by Eddie Bravo,150000.0,https://www.youtube.com/watch?v=RJ7Iutti8cY
132,How To Never Get Your BJJ Guard Passed by Xande Ribeiro,140000.0,https://www.youtube.com/watch?v=e86MOTgrzgs
140,How To Do Perfect Guard Retention In BJJ by John Danaher,140000.0,https://www.youtube.com/watch?v=ce_0XT1BBQA
407,Armbar From Side Control by Demian Maia,130000.0,https://www.youtube.com/watch?v=l0SRthnG9R8
78,How To Perform The Perfect Rear Naked Choke by John Danaher,130000.0,https://www.youtube.com/watch?v=l8-JI7NND3E
397,The Best Knee Cut Pass by Lucas Lepri,130000.0,https://www.youtube.com/watch?v=3IqCi1GXmOg
143,Understanding The Closed Guard by Gordon Ryan,130000.0,https://www.youtube.com/watch?v=nU9YxDabnSU
75,What Are The Most Important Skills Needed For A BJJ Blue Belt by John Danaher,120000.0,https://www.youtube.com/watch?v=ifk_UWknVKY
333,Full Nelson Defense by Dean Lister,120000.0,https://www.youtube.com/watch?v=SAOYcLy7dd0
96,The Shoulder Crunch Sumi Gaeshi Sweep From Butterfly Guard by Gordon Ryan (ADCC 2019 Breakdown),120000.0,https://www.youtube.com/watch?v=VFbUih8C-Lk
107,3 BJJ Chokes That Everybody Should Know by Lachlan Giles (Amazing Details),120000.0,https://www.youtube.com/watch?v=LhB7Y7LAig0
109,How To Build The Perfect BJJ Closed Guard Game by John Danaher,120000.0,https://www.youtube.com/watch?v=otskR_OjuBU
80,The Best Single Leg Takedown For Brazilian Jiu Jitsu by Andre Galvao,110000.0,https://www.youtube.com/watch?v=4HBVdF5AXc0
448,Best Sweep vs Bigger Opponents by 8x World Champion Bruno Malfacine,110000.0,https://www.youtube.com/watch?v=UMPZeljofwA
438,Understanding The Berimbolo By Gianni Grippo,100000.0,https://www.youtube.com/watch?v=bsbFpa9q7Ig
64,BJJ Butterfly Guard - Most Important Principles by Marcelo Garcia,100000.0,https://www.youtube.com/watch?v=0WG1MYvgXAM
478,The Easiest Takedown For BJJ Players,97000.0,https://www.youtube.com/watch?v=s5k4Kh8ErS8
419,"How To Do The Heel Hook By The Best Footlock/Leglock Grappler in The World ""Dean Lister""",95000.0,https://www.youtube.com/watch?v=haBJPddcCvo
460,Bernardo Faria vs Erberth Santos  2015 IBJJF Worlds Absolute,91000.0,https://www.youtube.com/watch?v=0tzVjj3slKs
404,The Tightest Reverse Triangle Choke by Braulio Estima,89000.0,https://www.youtube.com/watch?v=2lCqmpZMhoI
167,One Of The Best BJJ Half Guard Sweeps (The Coyote Half Guard) by Lucas Leite,88000.0,https://www.youtube.com/watch?v=INqZhKrlNKk
309,5 Tips To Improve Your Half Guard by Bernardo Faria & Tom Deblass,88000.0,https://www.youtube.com/watch?v=ZPrmnK1cWjI
329,Crazy Inside Heel Hook Setup From Craig Jones,88000.0,https://www.youtube.com/watch?v=CRFYfSasVjI
44,What To Do When You Can’t Train Jiu Jitsu (Coronavirus) by John Danaher,87000.0,https://www.youtube.com/watch?v=s3Z8sWJmSHM
83,Understanding The Open Guard In BJJ by John Danaher,87000.0,https://www.youtube.com/watch?v=Fcg4mtegux0
425,How To Avoid Getting Smashed by The Bigger Guys by 8x World Champion Bruno Malfacine,86000.0,https://www.youtube.com/watch?v=vZXD3t-y7X4
421,Grip Fighting by The Best Judo Coach In The US History - Jimmy Pedro,83000.0,https://www.youtube.com/watch?v=PEmEMbFhB1w
370,Half Guard Frame - How To Prevent The Guard Pass by Tom Deblass,81000.0,https://www.youtube.com/watch?v=lhkkgA4K6o8
351,The Inescapable Toehold From De La Riva by Dean Lister,78000.0,https://www.youtube.com/watch?v=Ig5VZfHE1Qg
131,Understanding The Tarikoplata by Tarik Hopstock (The Creator Of The Tarikoplata),75000.0,https://www.youtube.com/watch?v=9yyauPoZmGI
50,How To Perfect Your North South Choke by Marcelo Garcia,73000.0,https://www.youtube.com/watch?v=VkI7wuhN2Ps
445,The Best Crucifix by Marcelo Garcia's Black Belt Joel Burgess,72000.0,https://www.youtube.com/watch?v=kUvLT0CoBcc
288,The Side Control Loop Choke By Kurt Osiander,72000.0,https://www.youtube.com/watch?v=_Hd_uqGqYjI
114,The Importance Of BJJ Fundamentals by John Danaher,72000.0,https://www.youtube.com/watch?v=-zgwLkCoWDw
399,The Catch Wrestling Cradle Sequence by Neil Melanson,64000.0,https://www.youtube.com/watch?v=sxzJbhtf8bo
105,5 Tips To Pass Any Guard No Gi by Lachlan Giles,61000.0,https://www.youtube.com/watch?v=Zp9O6YpHKeE
344,Side Control Escape Against A Bigger Opponent by Fabio Gurgel,60000.0,https://www.youtube.com/watch?v=n0-UmQoT3Lo
89,Understanding The Jiu Jitsu Open Guard by Gordon Ryan,59000.0,https://www.youtube.com/watch?v=LPet-GrNNB8
185,How To Do The Tightest Darce Choke by Edwin Najmi,59000.0,https://www.youtube.com/watch?v=0Dx5Ecj2yV4
111,How To Do The Heel Hook Against Bigger And Stronger Opponents by Lachlan Giles (ADCC 2019 Breakdown),57000.0,https://www.youtube.com/watch?v=7k9gz9O2CWE
175,Basic Foot Locks & Leg Attacks For BJJ White Belts (Beginners) by Warren Brooks,56000.0,https://www.youtube.com/watch?v=Hlh2NRQ_EJQ
72,Jiu Jitsu vs Wrestling - Understanding Turtle Position by Gordon Ryan,54000.0,https://www.youtube.com/watch?v=A8JVwd_OoSY
255,The Arm In Guillotine by Gordon Ryan (The One Used In The Adcc Finals 2017 Against Keenan Cornelius),53000.0,https://www.youtube.com/watch?v=raUOzIkDt5k
468,"How To Sweep The Bigger/Stronger Opponent by Mansher ""Munchie"" Khera",51000.0,https://www.youtube.com/watch?v=hkupyxJnS-s
328,Invisible Choke From Side Control by Tom Oberhue,49000.0,https://www.youtube.com/watch?v=rjP4GvxTO6s
18,The Most Basic Principles Of Butterfly And Open Guard by Gordon Ryan,48000.0,https://www.youtube.com/watch?v=MXcQfCIh7n4
148,Understanding The Butterfly Guard by Jonathan Satava,47000.0,https://www.youtube.com/watch?v=P0Fz-64lAs4
317,Killing The Knee Shield by Yuri Simoes,46000.0,https://www.youtube.com/watch?v=GFA1smN1UzQ
310,Purple Belt  - The Hardest Belt In BJJ,46000.0,https://www.youtube.com/watch?v=a1Xdpgc8Rng
285,Gogoplata From Rubber Guard by Eddie Bravo's Black Belt Brandon Mccaghren,46000.0,https://www.youtube.com/watch?v=wn39-wrfsbs
101,How To Sweep Wrestlers From BJJ Half Guard by Lachlan Giles,45000.0,https://www.youtube.com/watch?v=rNxVLwBrhsY
201,The New Kimura by Olympic Judo Champion Satoshi Ishii,45000.0,https://www.youtube.com/watch?v=aYuqadiEGEA
153,Judo vs Jiu Jitsu Takedown by Ilias Iliadis (Olympic Judo Champion),44000.0,https://www.youtube.com/watch?v=rvuK3uZ3UQ0
477,Bernardo Faria vs Luiz Panza - IBJJF Worlds 2013,42000.0,https://www.youtube.com/watch?v=PKnaoJMmdI4
283,Butterfly Sweep Crossing The Arm by Adam Wardziński,40000.0,https://www.youtube.com/watch?v=UUSFGMNcH5A
81,Very Efficient Knee Cut BJJ Guard Passing No Gi by JT Torres,40000.0,https://www.youtube.com/watch?v=F1Nd4MmLuDk
108,Best Moves To Practice Before And After BJJ Classes by James Tomlinson,39000.0,https://www.youtube.com/watch?v=B-dlwHdxCYM
94,The Best BJJ Concepts To Pass Any Guard by André Galvão,39000.0,https://www.youtube.com/watch?v=836JWqonl4Y
258,Von Flue Choke by James Clingerman,38000.0,https://www.youtube.com/watch?v=8-spDes3hnE
209,Concepts About Balance & Base With The Best On It - Lucas Lepri,37000.0,https://www.youtube.com/watch?v=UkLuXpUQp38
476,Triangle From Half Guard (Z Guard/Knee Shield) by Dillon Danis,37000.0,https://www.youtube.com/watch?v=-AdaVO7ywzs
450,How To Break The Standing Posture By Travis Stevens,36000.0,https://www.youtube.com/watch?v=y2xC-WFeCps
446,Armbar From North South Choke by Paul Schreiner,36000.0,https://www.youtube.com/watch?v=6R4hlTfrFKA
373,How Long Takes To Get The Black Belt In Jiu-Jitsu,36000.0,https://www.youtube.com/watch?v=yX7G40FiPrY
0,Best Takedowns For Jiu Jitsu (BJJ) by John Danaher,36000.0,https://www.youtube.com/watch?v=Swoni-e1CFg
384,Crazy Lapel Choke From A Purple Belt,36000.0,https://www.youtube.com/watch?v=B2WRuZX1jt8
487,Bernardo Faria x Erberth Santos 2015 - Semi-Finals Pan-Ams 2015,35000.0,https://www.youtube.com/watch?v=50-jnfJsRDY
62,The Best Double Leg Takedown For Jiu Jitsu by Marcus “Buchecha” Almeida,35000.0,https://www.youtube.com/watch?v=ETpgDGw1ITs
409,Omoplata Escapes by Dean Lister,35000.0,https://www.youtube.com/watch?v=hMMn5jt-fsI
320,Killer Guillotine by Neil Melanson,35000.0,https://www.youtube.com/watch?v=le9JMzeJdXA
500,Bernardo Faria Highlight - Brazilian Jiu-Jitsu 2011,35000.0,https://www.youtube.com/watch?v=-UoK4D9hjQA
40,How To Do The Perfect Imanari Roll by Masakazu Imanari,34000.0,https://www.youtube.com/watch?v=BJ9c7L3lmPc
12,3 Most Important Jiu Jitsu Strangles (Chokes) by John Danaher,33000.0,https://www.youtube.com/watch?v=Izvp9TAmAxs
414,Over Under Pass By Jimmy Pedro,33000.0,https://www.youtube.com/watch?v=Q09MS_Z5pXk
73,Amazing Monoplata From Triangle Choke by JT Torres,32000.0,https://www.youtube.com/watch?v=B7oBJUQUBDk
207,The Catch Wrestling Leg-Locks by Neil Melanson,32000.0,https://www.youtube.com/watch?v=dfsotaaH4lk
113,Fun Way To Learn The Darce Choke - The Bar Darce - by Jeff Glover,32000.0,https://www.youtube.com/watch?v=t6FiiticH3Y
484,The Biggest Mistake In The Hip-Escape by Bernardo Faria,32000.0,https://www.youtube.com/watch?v=apizQSCXLwo
92,The Best Low Outside Single Leg Takedown by Nick Rodriguez,31000.0,https://www.youtube.com/watch?v=e5xJPMn7ogc
110,Lachlan Giles 50/50 Heel Hook - A Completely Different Entry Concept: Outside Sankaku,31000.0,https://www.youtube.com/watch?v=S46WqRwc9v4
126,37 Different Wrist Locks From Every Position by Pete The Greek,30000.0,https://www.youtube.com/watch?v=jyJX58s0I4c
102,Blue Belt In BJJ & Second Place In The ADCC - Nick Rodriguez Explains His Conditioning Training,30000.0,https://www.youtube.com/watch?v=SSx-drAYWMo
358,Sweep While Getting Smashed In Half-Guard By Josh Roth,29000.0,https://www.youtube.com/watch?v=D77B641EIIc
106,The Cart Wheel BJJ Guard Pass by Nick Rodriguez,29000.0,https://www.youtube.com/watch?v=ZVD58KZ609A
470,Build Olympic Grip Strength With USA Judo Star Travis Stevens - 3 Different Exercises for Grips,28000.0,https://www.youtube.com/watch?v=eng2vC41nKM
423,Lasso Sweep Going Straight To The Armbar by Marcos Tinoco,28000.0,https://www.youtube.com/watch?v=CtdlZ2CVa24
429,Anaconda Choke From Half-Guard by Chris Lyon,28000.0,https://www.youtube.com/watch?v=K6Z6wrwqeMI
225,Exclusive Interview With BJJ Fanatics Best Selling Instructor - John Danaher,27000.0,https://www.youtube.com/watch?v=4_cH9A-XWtg
366,Single Leg Half-Guard Sweep Grabbing The Pants by Leonardo Saggioro,27000.0,https://www.youtube.com/watch?v=MWWO43BpaRY
39,The Most Deadly Grappling Choke From The Cradle Position by Neil Melanson,26000.0,https://www.youtube.com/watch?v=xm1XKIxVw20
348,Scisor Sweep Hacks by Chris Haueter,26000.0,https://www.youtube.com/watch?v=edRzi_vzgdc
233,Butterfly Hook Sweep Blocking The Arm by Gordon Ryan,26000.0,https://www.youtube.com/watch?v=0Vs_Yih_hg8
466,"""The Last Chance"" Sweep From Half Guard by Bernardo Faria",26000.0,https://www.youtube.com/watch?v=NLAycCHcE6E
189,Tricky Butterfly Guard To Heel Hook by Craig Jones,26000.0,https://www.youtube.com/watch?v=kVHg38X5ZK8
202,Ouchi Gari For BJJ & Grip Control by Olympic Judo Champion Satoshi Ishii,25000.0,https://www.youtube.com/watch?v=2wGLgF-1Ffg
432,Best Way To Improve Your Cardio For BJJ by Bernardo Faria,25000.0,https://www.youtube.com/watch?v=smBNACmiALE
165,How To Pass The Closed Guard Using The Sao Paulo Pass by Leonardo Nogueira,25000.0,https://www.youtube.com/watch?v=r3oI5TvaWg0
38,The Dynamic Pin In Brazilian Jiu Jitsu by John Danaher,25000.0,https://www.youtube.com/watch?v=4zWa-pcjuLw
34,How To Do The Perfect Jiu Jitsu Half Guard Passing by John Danaher,25000.0,https://www.youtube.com/watch?v=Jz4oLDOHxLM
104,Escaping The Outside Heel Hook by Garry Tonon,25000.0,https://www.youtube.com/watch?v=X8KfQdRYZdQ
141,The Cradle Pass With Gi (BJJ Guard Passing) by Braulio Estima,24000.0,https://www.youtube.com/watch?v=WBwHnrSnuHo
493,Bernardo Faria - OMOPLATA,24000.0,https://www.youtube.com/watch?v=ObMEoLogpcw
436,Over Under Pass Counter by Diego Gamonal,24000.0,https://www.youtube.com/watch?v=vaJM8FO799Y
248,Lasso Guard Sweep With Crazy Fast Armbar by Marcos Tinoco,24000.0,https://www.youtube.com/watch?v=13xUxkYjqWo
424,Should you use strength when you are training BJJ?,24000.0,https://www.youtube.com/watch?v=SP-dXsv4YRY
307,BJJ Workout With Kettlebell - How To Do It Properly by Mike Perry,24000.0,https://www.youtube.com/watch?v=QkXOHbbyA6w
441,Wrestling or Judo For BJJ ?,23000.0,https://www.youtube.com/watch?v=YwsYmZwPhg0
433,From Z-Guard To Deep Half-Guard to Over-Under Pass by Misael Miranda,23000.0,https://www.youtube.com/watch?v=AXVp_E1aVEc
117,The Side Closed Guard by Xande Ribeiro,23000.0,https://www.youtube.com/watch?v=ppdYu0X50kc
164,The Easiest Half Guard Sweep For BJJ White Belt (Beginners) by Lucas Leite,23000.0,https://www.youtube.com/watch?v=4-Hf1h5WYfk
36,The Day That John Danaher Was Put To Sleep With A Jiu Jitsu Strangle (BJJ Choke),23000.0,https://www.youtube.com/watch?v=dR6NBwBzi20
467,Unlock The Lockdown by Bernardo Faria,22000.0,https://www.youtube.com/watch?v=bahZpShmZ80
116,Super Efficient BJJ Deep Half Guard Sweep No Gi by Jeff Glover,22000.0,https://www.youtube.com/watch?v=WNXrZjz8nFU
91,The Best Armbar From Side Control by Fabio Gurgel,22000.0,https://www.youtube.com/watch?v=-qO_lCZqgwE
444,Push Him Away From Knee Cut - FREE Technique from Bernardo Faria's New Half Guard DVD,22000.0,https://www.youtube.com/watch?v=q8buwG6oS0s
56,The Most Famous Back Take In Jiu Jitsu (Back Attack) by Leo Vieira,22000.0,https://www.youtube.com/watch?v=mcGu2CJMHpg
77,BJJ Triangle Choke From Side Control by Matheus Gonzaga,22000.0,https://www.youtube.com/watch?v=QX7R_HRDtyo
208,The Snap Guard by Neil Melanson,21000.0,https://www.youtube.com/watch?v=9qtoqB8fgPw
241,How To Defend The Leg Drag Going To The Straight Foot Lock by Mikey Musumeci,21000.0,https://www.youtube.com/watch?v=yEkVChd_FoE
342,How To Pass The Deep Half Guard by Dimitrius Souza,21000.0,https://www.youtube.com/watch?v=2mom9Urqxa4
449,Closed Guard: Breaking Posture and the Armbar by Dan Covel,21000.0,https://www.youtube.com/watch?v=jFRuW1WUfyU
362,Reverse Half-Guard By Jacke Mackenzie,21000.0,https://www.youtube.com/watch?v=mV15kNoGVkI
19,Very Effective Submission From BJJ Triangle to Armlock by Gordon Ryan,21000.0,https://www.youtube.com/watch?v=YlcTeTOb-9I
494,Bernardo Faria - Half-Guard Highlight,21000.0,https://www.youtube.com/watch?v=iX1P9R8VBsU
93,"13 Different Ways To Get The Folding Pass (BJJ Guard Passing) by Marcus ""Buchecha"" Almeida",21000.0,https://www.youtube.com/watch?v=NPvw5sAS8-k
2,New BJJ Triangle Choke Set Up On The Mount by Craig Jones,21000.0,https://www.youtube.com/watch?v=xnlx_hNfuZ4
4,Surprising BJJ Triangle Choke From Closed Guard by Giancarlo Bodoni,20000.0,https://www.youtube.com/watch?v=MbdpOmzThpQ
454,Bernardo Faria vs AJ Agazarm 2015 IBJJF Pan Ams  Open Class,20000.0,https://www.youtube.com/watch?v=m4P07fFMEuM
336,Closed Guard Sequence by Chris Haueter,20000.0,https://www.youtube.com/watch?v=vwH26muAA-s
447,How To Defend The Double Leg Takedown by 3x ALL AMERICAN Hudson Taylor,19000.0,https://www.youtube.com/watch?v=PVJ1QPgi-B4
312,Bernardo Faria Youtube Channel,19000.0,https://www.youtube.com/watch?v=U1Gux2tnrEg
76,Best Way To Pass Any BJJ Guard by Andre Galvao,19000.0,https://www.youtube.com/watch?v=GbWF9YVFTNw
70,The Best Self Defense Techniques For Women by Deborah Gracie,19000.0,https://www.youtube.com/watch?v=rPU_DKdkM4U
492,Bernardo Faria - One variation of his Over-Under Pass,19000.0,https://www.youtube.com/watch?v=RxdB3UXrdHQ
52,A New Way Of Guard Passing No Gi - The 50/50 With The Arms by Leo Vieira,19000.0,https://www.youtube.com/watch?v=zWH15KyojXo
7,The Tightest BJJ Arm Triangle by Neil Melanson,19000.0,https://www.youtube.com/watch?v=qIliKQiN2K8
51,Why I Always Say “Huge Honor For Me” - Bernardo Faria,19000.0,https://www.youtube.com/watch?v=NYGgM83_JWQ
437,What Every BJJ White Belt Should Focus In BJJ,19000.0,https://www.youtube.com/watch?v=KmcunkVTc_g
259,How To Use The Half Butterfly From Half Guard by Tom Deblass,19000.0,https://www.youtube.com/watch?v=bCwplWpcgJM
315,2 on 1 from Knee Shield by Bernardo Faria,19000.0,https://www.youtube.com/watch?v=u9Nt_cAvhE4
326,The American Gangster Head & Arm Choke From Chael Sonnen,18000.0,https://www.youtube.com/watch?v=Hw8-59qdvnU
481,From Deep Half Guard to X-Guard with Jonathan Satava,18000.0,https://www.youtube.com/watch?v=X5w4AUnKBNU
378,"Deep Half Guard Sweep Controlling The Sleeve by Felipe ""Pe de Pao"" Bueno",18000.0,https://www.youtube.com/watch?v=Tiy657WhNmk
420,Sweep From Double Under by Will Grundhauser,18000.0,https://www.youtube.com/watch?v=0I1vR6266mU
82,The Most Efficient Straight Foot Lock by Luiz Panza,18000.0,https://www.youtube.com/watch?v=Y5DrRj2GYcQ
112,BJJ Submission Traps: Darce Choke Or Arm In Guillotine by Jeff Glover,18000.0,https://www.youtube.com/watch?v=Q5j5iwut2eQ
234,"The Cyborg Flow - How A Heavy Weight Can Move Like A Light Weight by Roberto ""Cyborg"" Abreu",17000.0,https://www.youtube.com/watch?v=pgfO3gnKK0M
270,The Waiter Sweep From Deep Half-Guard by Lucas Valle,17000.0,https://www.youtube.com/watch?v=LzphtRQwv6g
301,Killer Straight Footlock by Chris Palmisano,17000.0,https://www.youtube.com/watch?v=Wl1NJNmtgTA
159,3 Tips For Every BJJ White Belt by Craig Jones,17000.0,https://www.youtube.com/watch?v=r4b--6mUfVc
212,No Arm Triangle With Romulo Barral,17000.0,https://www.youtube.com/watch?v=B88qZ0EOPRk
121,BJJ Guard Passing - The Headquarters Position by Rafael Lovato Jr.,17000.0,https://www.youtube.com/watch?v=grRK1_erIf8
97,Jiu Jitsu Escapes | The Main Concept That Everyone Should Know by Fabio Gurgel,16000.0,https://www.youtube.com/watch?v=3c0CDBhpZrw
49,The Most Precise Jiu Jitsu Guard Pass (Knee Cut) by Lucas Lepri,16000.0,https://www.youtube.com/watch?v=Q6rGog5h0Bk
458,The Most Dangerous Position In BJJ by Bernardo Faria,16000.0,https://www.youtube.com/watch?v=UEDuDkD8O34
471,Half Guard Sweep - Back Take - Choke - by Matheus Diniz,16000.0,https://www.youtube.com/watch?v=uXs2cPFwKN0
352,From Over-Under To Stack Pass by Leonardo Saggioro,16000.0,https://www.youtube.com/watch?v=Te2DOBY3Ghk
138,How To Do The Estima Lock by Braulio Estima (The Creator Of The Estima Lock),16000.0,https://www.youtube.com/watch?v=dwoUiTFBEaM
274,Foot Sweep BJJ Takedown by The Founder Of Fight To Win - Seth Daniels,15000.0,https://www.youtube.com/watch?v=m4R8ID-7yW0
195,Different Variation Of The Coyote Half Guard Sweep by Alexandre Vieira,15000.0,https://www.youtube.com/watch?v=h_86is23XFw
269,Cross Collar Choke From Closed Guard by Kyle Briere,15000.0,https://www.youtube.com/watch?v=seS_m8pXk9w
413,What To Do When You Can Only Train BJJ 2x Per Week,15000.0,https://www.youtube.com/watch?v=obv1jMMLxy0
87,Easy Sweep And Back Take From Closed Guard by Giancarlo Bodoni,15000.0,https://www.youtube.com/watch?v=ARlRch0kJ-8
69,"Five Efficient Wrist Locks From BJJ Closed Guard by Márcio ""Macarrão"" Stambowsky",15000.0,https://www.youtube.com/watch?v=1jjOJqGnFes
265,The Over Under Pass For No-Gi by Bernardo Faria,15000.0,https://www.youtube.com/watch?v=fZHugosJvh8
84,The Most Efficient Triangle Choke Starting From The Knees by Jeff Glover,15000.0,https://www.youtube.com/watch?v=1J3bZu_zKIE
79,Very Simple And Efficient Armbar From BJJ Closed Guard by Giancarlo Bodoni,15000.0,https://www.youtube.com/watch?v=2oVHEcyJhIM
439,The Battle Tested Half Guard 4 DVD Set - Coming soon,15000.0,https://www.youtube.com/watch?v=oz2agWy8SmI
57,The Fastest Submission From ADCC 2019 (Inverted Heel Hook) by Garry Tonon,15000.0,https://www.youtube.com/watch?v=x_DRP6_9IRA
289,The Best Submission Of 2017 - Loop Choke From Side Control by Alexandre Vieira,14000.0,https://www.youtube.com/watch?v=ySttlU611l4
339,"One Of My Favorite Omoplatas From My New DVD Instructional ""Omoplata Everyone""",14000.0,https://www.youtube.com/watch?v=s_96wZFUPew
124,"The Hidden Collar BJJ Guillotine by Vinicius ""Draculino""",14000.0,https://www.youtube.com/watch?v=BInzL3DaMt0
498,Bernardo Faria Worlds 2014 Highlight,14000.0,https://www.youtube.com/watch?v=UW4pdaJKPws
440,"Highlight Clip: Faria Commenting On His Sparring Sessions For His DVD ""The Battle Tested Half-Guard""",14000.0,https://www.youtube.com/watch?v=g4vqqbuZ1oU
275,"Butterfly Trap: Kimura From ""Turtle Guard"" by Eduardo Telles",14000.0,https://www.youtube.com/watch?v=9iDOotJ8y5Y
3,The Nastiest Heel Hook by Craig Jones (Used Against Vinny Magalhaes),14000.0,https://www.youtube.com/watch?v=Ov_N0dt5SIk
249,Kimura From Turtle Guard (Catch Wrestling Style) by Neil Melanson,14000.0,https://www.youtube.com/watch?v=ZpU1jttZMfk
457,How To Beat Wrestlers Using The Kimura by Robson Lima “Mau-Mau”,14000.0,https://www.youtube.com/watch?v=Xrg_T64FqVU
68,Easy BJJ Closed Guard Sweep by Deborah Gracie,14000.0,https://www.youtube.com/watch?v=63uMjGs2U5I
53,The Victors Roll - An Effective BJJ Submission That Everyone Should Know - by Garry Tonon,14000.0,https://www.youtube.com/watch?v=cbhrQ06ZdiA
411,When You Feel You Don't Deserve To Be Promoted To A New Belt,13000.0,https://www.youtube.com/watch?v=1BQZgvkPCkc
238,How To Beat The Bigger Opponent: Butterfly Collar Drag To Arm Bar by Bruno Malfacine,13000.0,https://www.youtube.com/watch?v=aVURND0RiVg
137,The Mirroring BJJ Guard by Wim Deputter,13000.0,https://www.youtube.com/watch?v=pGfadNloK0g
203,Concepts About Open Guard by Priit Mihkelson From BJJ Globetrotters,13000.0,https://www.youtube.com/watch?v=NvZyL09wtQs
305,How I Developed My Half Guard Game In Jiu-Jitsu,13000.0,https://www.youtube.com/watch?v=p_hTdengD68
42,A NEW Grappling (Jiu Jitsu) Submission From The K-Guard by Neil Melanson,13000.0,https://www.youtube.com/watch?v=qOp1Cdof-gE
118,"The Exorcist BJJ Guard Attack by Vinicius ""Draculino""",13000.0,https://www.youtube.com/watch?v=5jn1ZazmQAs
183,The Best Flying Triangle Choke In The World by Edwin Najmi,13000.0,https://www.youtube.com/watch?v=nQjnFuN5TWo
6,Unique BJJ Choke From The Shoulder Pin Guard (Williams Guard) by Neil Melanson,13000.0,https://www.youtube.com/watch?v=rsxYS1uX7Mg
146,5 Tips To Your First Jiu-Jitsu Class (BJJ Beginner),13000.0,https://www.youtube.com/watch?v=NfolwJqxRqI
169,Breaking The Closed Guard Posture No-Gi For White Belt by Shawn Williams,13000.0,https://www.youtube.com/watch?v=9aokuB9Jd48
426,Sneak Choke vs The Over Under Pass by Jason Eames,13000.0,https://www.youtube.com/watch?v=nINUfoSiSxw
252,Triangle From Hand On The Belt Closed Guard by Nicholas Meregali,13000.0,https://www.youtube.com/watch?v=akGu2VEk7Xs
244,How To Do The Collar Drag Attacking The Back And Choking by Roberto Jimenez,13000.0,https://www.youtube.com/watch?v=JDXVc5C07_M
99,How To Pass The BJJ Half Guard No Gi by Lachlan Giles,13000.0,https://www.youtube.com/watch?v=qrlXfEOk_44
14,Very Good Posture Control From BJJ Closed Guard by Karel “Silver Fox” Pravec,13000.0,https://www.youtube.com/watch?v=tdy5gXZTyXU
232,The Ground Marshal Half Guard by Neil Melanson,12000.0,https://www.youtube.com/watch?v=G8m-5sXL_ZM
401,The Best Way To Get Out Of The X-Guard by Isaque Bahiense,12000.0,https://www.youtube.com/watch?v=XhLd-CMQBUQ
347,Loop Choke From Double Under Pass by Daniel Beleza,12000.0,https://www.youtube.com/watch?v=MTCYW9hR10Y
276,Great Detail To FInish The Omoplata by Kyra Gracie,12000.0,https://www.youtube.com/watch?v=t9aUmxnzOLo
217,Surprise Grappling Attack by Chael Sonnen,12000.0,https://www.youtube.com/watch?v=K6BS6kCoTaw
198,Reverse Half Guard Sweep by Masahiro Iwasaki,12000.0,https://www.youtube.com/watch?v=JbuhdPpHey8
418,Spider Guard Drills by Rehan Muttalib,12000.0,https://www.youtube.com/watch?v=0feitwQw888
306,How To Counter The Dogfight (Half Guard Sweep) by Rayron Gracie,12000.0,https://www.youtube.com/watch?v=eKtGQqwJwWM
479,Bernardo Faria's Pressure Passing Breakdown,12000.0,https://www.youtube.com/watch?v=Ntd5AoAOlS4
103,Very Efficient No-Gi BJJ Guard Passing by Matheus Diniz,12000.0,https://www.youtube.com/watch?v=JFFHDCUBMfg
88,The Best Guard Pass Against The Lapel Guard by André Galvão,12000.0,https://www.youtube.com/watch?v=kS0xQoF6jmU
191,Amazing Detail To Finish The Kimura by Kazushi Sakuraba,12000.0,https://www.youtube.com/watch?v=bUAJlxgnLh4
193,The Faria Sweep From Deep Half Guard by Masahiro Iwasaki,12000.0,https://www.youtube.com/watch?v=q83q61ZVAy4
485,Arm Drag Trap From Standing  by Bernardo Faria,11000.0,https://www.youtube.com/watch?v=P06WvfyS024
282,5 Great Exercises For BJJ by Malcom Gwilliam,11000.0,https://www.youtube.com/watch?v=nA36SWoSbqI
