,title,view_num,url
74,The Top 5 Moves For White Belts,280000.0,https://www.youtube.com/watch?v=SpWfuVhqQsk
242,The Awesome D'arce Choke - One Of My Favourites!,270000.0,https://www.youtube.com/watch?v=v_WjtZVGzvE
46,The Kesa Gatame Kill System,160000.0,https://www.youtube.com/watch?v=G0Xf_CJzE6M
189,Closed Guard - A Simple But Awesome Move!,140000.0,https://www.youtube.com/watch?v=C52IGiZNBg8
188,An Awesome Submission Series - From Mount,140000.0,https://www.youtube.com/watch?v=fyK6TvKVy8c
300,5 Beginner Mistakes You Are Probably Making - And It's Hurting Your Jiu Jitsu,130000.0,https://www.youtube.com/watch?v=AReJUFsuczg
543,3 AWESOME Hacks to Pass ANY Guard!,110000.0,https://www.youtube.com/watch?v=3dRbzta6Elc
311,Half Guard 101 - What To Do When You Have Someone In Your Half Guard,110000.0,https://www.youtube.com/watch?v=9zKr-xYlPcg
57,"The Amazing Darce - Version 2, NEW",96000.0,https://www.youtube.com/watch?v=iC1Tl7cP_KM
415,How To Get The Omoplata From Closed Guard - EVERYTIME!,94000.0,https://www.youtube.com/watch?v=yOGbaXm3Htw
542,An AWESOME little Trick to Escape Side Control - Every time!,90000.0,https://www.youtube.com/watch?v=up7SgqQyW3M
309,3 Stupid Things (Some) Beginner Students Do That I Hate!,88000.0,https://www.youtube.com/watch?v=FMCUTSTZvAA
41,The Nastiest Choke From Guard,82000.0,https://www.youtube.com/watch?v=GsVSXGrVK4w
396,Two BJJ Lies - I Wish I Knew 10 Years Ago!,81000.0,https://www.youtube.com/watch?v=D4ibUsfDYG8
202,Darce Choke Set ups!,79000.0,https://www.youtube.com/watch?v=-xWYkAdlnss
541,How to use this trick to ESCAPE the rear naked choke - every time!,76000.0,https://www.youtube.com/watch?v=x5o36dSAqqM
491,How to USE A GRAPPLING DUMMY plus a REVIEW!,70000.0,https://www.youtube.com/watch?v=MGiuryZfAmo
527,An AWESOME Mount ESCAPE - And you end up ON TOP!,68000.0,https://www.youtube.com/watch?v=N0lo6IVvsss
55,White Belt Tips For Mount Escapes,66000.0,https://www.youtube.com/watch?v=dYIWSoTw9a0
354,Gogoplata And Locoplata - From Closed Guard!,65000.0,https://www.youtube.com/watch?v=wzOrAzClA8k
222,Mounted Triangle - The Easy Way!,63000.0,https://www.youtube.com/watch?v=JNNuVJfWdkY
540,A cheeky little choke when caught in closed guard!,61000.0,https://www.youtube.com/watch?v=B3QjZqLk2i8
205,How To Lock A Triangle - Everytime!,59000.0,https://www.youtube.com/watch?v=DSuh4MRwqHg
531,An AWESOME MOVE - The Rolling Side Control Escape,59000.0,https://www.youtube.com/watch?v=gFu27SZJTsA
106,The Baseball Bat Choke,59000.0,https://www.youtube.com/watch?v=mBcQiWrIdhs
231,Tricks From Closed Guard!,57000.0,https://www.youtube.com/watch?v=rseARbWd988
549,4 Awesome hacks to finish a triangle - Every time!,56000.0,https://www.youtube.com/watch?v=r-QDTYnGyCw
196,The Von Flue Choke   The Guillotine Antidote,54000.0,https://www.youtube.com/watch?v=aKbF3RXfUZE
363,Buying A Gi - What You Need To Know!,54000.0,https://www.youtube.com/watch?v=vt6haHU6Wx8
421,4 LEG LASSO Techniques - REAL FAST!,52000.0,https://www.youtube.com/watch?v=8u1c8ZEy0IU
388,The Helio Grip - Get That Cross Choke - Everytime!,52000.0,https://www.youtube.com/watch?v=gsqpOPdpJ3Q
378,The Awesome Ezekiel Choke!,50000.0,https://www.youtube.com/watch?v=ItXDuC3EA-4
126,A Realistic But Effective Closed Guard Break,48000.0,https://www.youtube.com/watch?v=--fv1lLaKmw
357,How To Tie Your Belt - The Right Way!,47000.0,https://www.youtube.com/watch?v=G4fhYTzTSN4
127,How To Roll With Bigger Guys,46000.0,https://www.youtube.com/watch?v=Vc2nwfRPnMU
423,Two Breathing Secrets That Will Change Your CARDIO FOREVER!,45000.0,https://www.youtube.com/watch?v=25QxKitS6og
285,How Jiu-Jitsu Will Change Your Life,45000.0,https://www.youtube.com/watch?v=4s1XNCh_MHE
104,Surviving Your First Day In BJJ!,45000.0,https://www.youtube.com/watch?v=02doCuxH8ig
203,A Cheaky North South Choke!,45000.0,https://www.youtube.com/watch?v=LVpp35wjljk
518,An AWESOME Technique to Escape the TRIANGLE - EVERYTIME!,44000.0,https://www.youtube.com/watch?v=MKB67hv1k-8
459,The MOST Dangerous FOOTLOCK - Still Legal at Whitebelt!,42000.0,https://www.youtube.com/watch?v=WQPeQx4v1W8
478,How to BEAT the LOCKDOWN - Every Time!,42000.0,https://www.youtube.com/watch?v=Wy26Ovpl-uc
443,How To Get HYPER FLEXIBLE For Jiu Jitsu!,40000.0,https://www.youtube.com/watch?v=MnvkdxHyD3U
404,A Beginners Guide To Joining Jiu Jitsu!,40000.0,https://www.youtube.com/watch?v=Qw-xSr3bLNs
171,The Easiest Side Control Escape!,39000.0,https://www.youtube.com/watch?v=kBkSDpLT2Pg
493,A Tricky KIMURA From SIDE CONTROL!,39000.0,https://www.youtube.com/watch?v=jHI-5v9lLHg
75,How To Start From Your Knees,39000.0,https://www.youtube.com/watch?v=tQ-4ZRJqQMQ
511,HOW to ESCAPE the BOW and ARROW Choke - Every time!,39000.0,https://www.youtube.com/watch?v=9nBFYgiHbW0
498,The AWESOME PENDULUM Sweep!,39000.0,https://www.youtube.com/watch?v=gghKAwjG25Q
330,5 Attacks From Lapel Closed Guard,38000.0,https://www.youtube.com/watch?v=wQK84XNdhk0
298,Kesa Gatame Escape - The Basics,38000.0,https://www.youtube.com/watch?v=2053an0m5tc
424,Two Moves That Will Get You OUT OF MOUNT - Every Time!,37000.0,https://www.youtube.com/watch?v=SfqnOMWM6XY
392,The Truck Attack Series!,36000.0,https://www.youtube.com/watch?v=51O_f1QKuyg
167,Finishing Head And Arm Chokes!,36000.0,https://www.youtube.com/watch?v=0b7z9fPGdv8
54,How To Make That Cross Choke Work!,36000.0,https://www.youtube.com/watch?v=JYRmggZ9YV8
35,"Butterfly Guard, Attack System",36000.0,https://www.youtube.com/watch?v=ndWgjVrvHpg
466,The Leg LASSO CATAPULT Sweep!,36000.0,https://www.youtube.com/watch?v=POK6BCIB38w
29,How To Stop Your Guard Getting Passed - Every-time!,36000.0,https://www.youtube.com/watch?v=mWcJ4M8DUQo
303,BJJ Etiquette,32000.0,https://www.youtube.com/watch?v=NCuEonymk_0
513,The EASIEST FINISH in Jiu Jitsu?,32000.0,https://www.youtube.com/watch?v=M3obHmh_Vj4
503,How to Practice to Massively Improve your CHOKE POWER!,32000.0,https://www.youtube.com/watch?v=4SMxETaewIM
361,A Simple But Awesome Armbar - From Guard!,32000.0,https://www.youtube.com/watch?v=clZeVyUb9mY
77,How to Finish Triangles- on either side!,31000.0,https://www.youtube.com/watch?v=tL9JPtSYdN8
492,Starting from knees: TAKEDOWN/ARMBAR combo!,31000.0,https://www.youtube.com/watch?v=ig3xT7TCYBw
399,My Favourite Triangle Set Ups From Closed Guard!,30000.0,https://www.youtube.com/watch?v=qDfyl_kN47k
81,White Belt Basic   Arm Bar From Closed Guard,30000.0,https://www.youtube.com/watch?v=mMQjtRBE1uA
365,A Simple But Unstoppable Forearm Choke,29000.0,https://www.youtube.com/watch?v=yd85M4iM-6Q
526,Using the LEG LASSO to stop ANYONE passing YOUR guard!,29000.0,https://www.youtube.com/watch?v=ahur0U700cU
28,Survive AND Escape side control EVERY TIME!!!,29000.0,https://www.youtube.com/watch?v=i0k_fFC0WBI
53,A White Belts Guide To Sweeps - From Open Guard,29000.0,https://www.youtube.com/watch?v=OzLAxuD3Vfo
45,The Safest Pass For White Belts,29000.0,https://www.youtube.com/watch?v=qMAUai1WKt0
289,The North South Choke!,28000.0,https://www.youtube.com/watch?v=WV44noRF2wg
162,Hip Escape Hacks!,27000.0,https://www.youtube.com/watch?v=9IhaQP1FVzo
43,4 Ways To Escape Mount - For White Belts,26000.0,https://www.youtube.com/watch?v=61-tePgIJ6Y
228,A Darce And Anaconda Drill!,25000.0,https://www.youtube.com/watch?v=iqUWdcJ_TqU
152,Overhook Attacks From Guard!,25000.0,https://www.youtube.com/watch?v=e0nIHYyWqIk
225,Armbar And Darce   Taken From Knee Ride,25000.0,https://www.youtube.com/watch?v=pnJnvTnyF1o
347,The Awesome Kesa Gatame!,24000.0,https://www.youtube.com/watch?v=ibbMRp_h0a0
102,The Back Attack Series,24000.0,https://www.youtube.com/watch?v=w1ZZQeiyw7U
85,A Simple Tip   To Help White Belts Pass The Guard,24000.0,https://www.youtube.com/watch?v=dajVUd-5Lsc
537,Guard Retention Techniques & Drills That Will Totally TRANSFORM YOUR GAME,24000.0,https://www.youtube.com/watch?v=mJTQT4tc79I
391,The Awesome Hip Bump Sweep!,23000.0,https://www.youtube.com/watch?v=B-kuT_ZinkI
468,A Fantastic PASS - The OVER UNDER Pass!,23000.0,https://www.youtube.com/watch?v=Pu1VlVsJ_6k
170,The Easiest Way To Escape Mount,23000.0,https://www.youtube.com/watch?v=lcIqosv86BY
37,Killer Kimura Attacks - From Z Guard,22000.0,https://www.youtube.com/watch?v=vmGMydNv-2M
519,Passing the SPIDER GUARD - The EASY WAY!,22000.0,https://www.youtube.com/watch?v=6hiTyJwd4WE
84,How To Prevent Side Control,22000.0,https://www.youtube.com/watch?v=YxHRU7eLp_8
178,The Kimura Hip Bump Sweep - Kimura Combo,21000.0,https://www.youtube.com/watch?v=CCos35cv5T8
103,Trouble Shooting Your Guillotine Choke!,21000.0,https://www.youtube.com/watch?v=LfJDoNuuvQs
40,The Best Knee Slice Pass COMBO on YouTube!,21000.0,https://www.youtube.com/watch?v=38p0AXZua6Y
51,White Belt Tips For Keeping Side Control,21000.0,https://www.youtube.com/watch?v=efVwsYGFxJE
340,Kesa Gatame Into Head And Arm Choke!,20000.0,https://www.youtube.com/watch?v=YVq4esK1FLc
158,4 Awesome Attacks From Shin To Shin,20000.0,https://www.youtube.com/watch?v=qyl5VLxpNiM
450,The UNSTOPPABLE Spider Guard SWEEP!,20000.0,https://www.youtube.com/watch?v=NY3j1_uC6R0
497,HOW to Execute the PERFECT BOW & ARROW Choke!,20000.0,https://www.youtube.com/watch?v=SFqJrF4cRKM
413,The Easiest Guard Break in Jiu Jitsu?,20000.0,https://www.youtube.com/watch?v=PX3T6mBZHKM
548,How to finish the armbar - every single time!,19000.0,https://www.youtube.com/watch?v=68oELQy4k6I
533,How do you ROLL with FEMALE Jiu Jitsu Athletes at YOUR Academy,19000.0,https://www.youtube.com/watch?v=AJyeHDD_NHs
212,Open Guard Sweeps!,19000.0,https://www.youtube.com/watch?v=J6_XxP-bfrE
444,HOW To Develop CRAZY GRIP Strength For BJJ!,19000.0,https://www.youtube.com/watch?v=ARIoa1D6Q88
176,Baratoplata Set-ups - Number 1 (of 3),19000.0,https://www.youtube.com/watch?v=nOqhD-TNDk8
50,White Belt Passing Combo,19000.0,https://www.youtube.com/watch?v=Scds9yJX5v0
250,Americana From Closed Guard - Easy!,18000.0,https://www.youtube.com/watch?v=RfdHcRQFQn8
39,Awesome Lapel Closed Guard Sweeps - You Must Know!,18000.0,https://www.youtube.com/watch?v=XYqS-5zcCiU
214,A Sneaky Attack - The Mouse Trap Americana,18000.0,https://www.youtube.com/watch?v=C7u5vY4mG8g
48,The Awesome Clock Choke,18000.0,https://www.youtube.com/watch?v=mNnsmxy8Gzs
362,Nutrition And Supplements In Jiu Jitsu!,18000.0,https://www.youtube.com/watch?v=zt2iNaWIRiw
64,How To Escape Back Control,18000.0,https://www.youtube.com/watch?v=884mtF-1ytA
67,Scissor Sweeps - everything you need to know!,17000.0,https://www.youtube.com/watch?v=jnWYxNem1ao
320,Scissor Sweep-The Basics!,17000.0,https://www.youtube.com/watch?v=ndOuM8R4Zs0
345,Big Secret - My 40 Year Old Students Are The Toughest!,17000.0,https://www.youtube.com/watch?v=e2QUx1wb6_c
434,HOW To Stretch To Be HYPER FLEXIBLE!,17000.0,https://www.youtube.com/watch?v=1CJvKy5iFwY
326,The Fantastic Forearm Choke!,17000.0,https://www.youtube.com/watch?v=RbvwI126BuI
113,De La Riva Sweep (1 of 3),17000.0,https://www.youtube.com/watch?v=TW5vTFC4LNE
306,The Secret To Breaking And Keeping Posture - When In Guard,17000.0,https://www.youtube.com/watch?v=wZKDhP6Xen4
418,SPIN Under to Get the Armbar - EVERYTIME!,17000.0,https://www.youtube.com/watch?v=nBHy4rNTw8c
528,The SNAP ARMBAR - From Side Control!,16000.0,https://www.youtube.com/watch?v=84Q0fE9zfJ0
337,Get Out Of Closed Guard - A HACK!,16000.0,https://www.youtube.com/watch?v=nPAbSx6a98o
359,How To Escape The Knee On Belly!,16000.0,https://www.youtube.com/watch?v=OU3CdJ1RTVo
59,SPIN CHOKE/ Baseball bat choke,16000.0,https://www.youtube.com/watch?v=gZW6qdYe4b0
60,Preventing Side Control,15000.0,https://www.youtube.com/watch?v=7U8dThjTZLU
283,The Grappling Academy Introduction,15000.0,https://www.youtube.com/watch?v=Q1xq_s8nofs
547,Simple tricks that will help you get a tap from the back -Every time!,15000.0,https://www.youtube.com/watch?v=YXL-yVlvgGE
34,"The Super, Awesome - Ninja Roll",15000.0,https://www.youtube.com/watch?v=R50IPDeSv0I
496,HOW to Use SWISS BALLS to Make MASSIVE IMPROVEMENT in BJJ!,15000.0,https://www.youtube.com/watch?v=rnC360DCKEY
210,Omoplata Hacks!,15000.0,https://www.youtube.com/watch?v=r8qPQIKfL1s
474,Two HACKS that will TRANSFORM Your BJJ Progress!,15000.0,https://www.youtube.com/watch?v=jm04Bj7qqDo
31,Don't Be That Person - Who gets The Back - But Can't Finish!,15000.0,https://www.youtube.com/watch?v=thatcCH_9uA
551,Super Fight - Coach Tom & Coach Johny,15000.0,https://www.youtube.com/watch?v=j2nMvoexHsA
151,The Cradle Attack Series - The Anaconda Choke,15000.0,https://www.youtube.com/watch?v=gQy-mmKJSu0
420,The EASIEST Side Control ESCAPE In Jiu Jitsu?,15000.0,https://www.youtube.com/watch?v=m_4nu86TifY
410,A Guillotine Defence Straight Into a Von Flue Choke,14000.0,https://www.youtube.com/watch?v=wZZz8CmxObQ
356,The Hip Bump Triangle!,14000.0,https://www.youtube.com/watch?v=tl_HPzgbkCQ
100,New To BJJ? - Follow This Path!,14000.0,https://www.youtube.com/watch?v=n5NHehRJ1RI
329,Street Self Defence X-chokes in T-shirts!,14000.0,https://www.youtube.com/watch?v=5zidirrttqc
25,Easiest Way To Escape Mount!,14000.0,https://www.youtube.com/watch?v=F13WWpFjPgE
544,Some TOP TIPS to stop being CRUSHED in BJJ!,14000.0,https://www.youtube.com/watch?v=7GDA79XDlr0
402,4 Hacks To MASSIVELY Increase Side Control Pressure!,14000.0,https://www.youtube.com/watch?v=b85hQ9YcaZE
119,Underhooks And Overhooks 101,14000.0,https://www.youtube.com/watch?v=vgund5eQcnc
44,An Awesome Way To Break The Guard - For White Belts,14000.0,https://www.youtube.com/watch?v=6m46YbmuRP8
116,Choke Options When Your Partner Is In Turtle!,14000.0,https://www.youtube.com/watch?v=5fRGRO6jUPE
419,The Easy HACK To Avoid Finger INJURY In Jiu Jitsu!,14000.0,https://www.youtube.com/watch?v=YK5a_ClZ8Z0
398,Get Into The Honey Hole - Finish With A Footlock!,14000.0,https://www.youtube.com/watch?v=XUwGTNO1SLE
148,A Handy Tip - To Get More Kimuras & Americanas,13000.0,https://www.youtube.com/watch?v=VQmfdXbvgjs
42,The Awesome - Von Flue Choke!,13000.0,https://www.youtube.com/watch?v=9ph1p1oSfQQ
65,The Mount 101 - The Essentials,13000.0,https://www.youtube.com/watch?v=u_bMy3mQjro
27,Pass Everyone's Half Guard !,13000.0,https://www.youtube.com/watch?v=0ZtvSQPcocY
213,Develop Your Open Guard - To Stop People Passing Your Guard,13000.0,https://www.youtube.com/watch?v=GmHM_RxMmBw
218,An Awesome Guillotine!,13000.0,https://www.youtube.com/watch?v=X_Dlz0RnvLI
433,Some simple TRICKS to Make YOUR BRIDGE and ROLL Unstoppable!,13000.0,https://www.youtube.com/watch?v=fNLj4sK_LUI
128,Old School Half Guard Sweep!,13000.0,https://www.youtube.com/watch?v=Afwz3TKcV9A
175,Baratoplata - Set-ups Number 2 (of 3),12000.0,https://www.youtube.com/watch?v=KwRGKNqrW3w
270,Are You A Grappler Or Striker - Use This Weird Trick To Find Out!,12000.0,https://www.youtube.com/watch?v=cz2iT17QgOA
539,A very cheeky arm in ezekiel choke - you will surprised how easy it is,12000.0,https://www.youtube.com/watch?v=zwUtoOjG0sI
36,"Tightness, A BlackBelts Insight!",12000.0,https://www.youtube.com/watch?v=WlVfJy-n5kw
295,Front Control To Kimura Or Armbar,12000.0,https://www.youtube.com/watch?v=c1dDXYVHx7Q
129,Lanky Guys Tricks and Tips,12000.0,https://www.youtube.com/watch?v=GLF0SXSPNxk
506,DEFEAT the HALF GUARD with the KIMURA!,12000.0,https://www.youtube.com/watch?v=nE1eZqD6SVs
395,An Awesome - Lapel Closed Guard!,12000.0,https://www.youtube.com/watch?v=PLvK0fyMo3I
182,Get That Guillotine - Use The Chin Strap,12000.0,https://www.youtube.com/watch?v=mhSri-cxfC8
219,Get The Choke From The Back - When They Duck The Chin!,11000.0,https://www.youtube.com/watch?v=y2UIOUo0sg8
482,Is BJJ Enough for SELF DEFENCE or MMA?,11000.0,https://www.youtube.com/watch?v=mKPYom7_-x8
274,How To Stop Flinching,11000.0,https://www.youtube.com/watch?v=veqheAYjPO8
71,How To Control Your Opponent,11000.0,https://www.youtube.com/watch?v=VZ5nqV-m9Ok
150,The Cradle Attack Series - The Darce Choke,11000.0,https://www.youtube.com/watch?v=DkHz2nVTV68
38,Awesome Lapel Closed Guard ATTACKS You Must Know!,11000.0,https://www.youtube.com/watch?v=F4wQ6JNKCrk
343,The Kesa Kimura!,11000.0,https://www.youtube.com/watch?v=sWd8NR7NDVM
92,Three Positions To Get The Arm in Ezekiel,11000.0,https://www.youtube.com/watch?v=bi89SQMRDOw
144,Ezekiel Choke - From Mount!,11000.0,https://www.youtube.com/watch?v=FjUh1O-0LVY
335,Kimura Hacks - When You Are Struggling to Finish The Kimura!,10000.0,https://www.youtube.com/watch?v=fd_iNmkRTMQ
389,Scissor Sweep Hacks!,10000.0,https://www.youtube.com/watch?v=e0MJKq9I3Lk
534,Signs that you are rolling TOO HARD or TOO SOFT?,10000.0,https://www.youtube.com/watch?v=rNSjdEcBh7c
383,What Is The Ideal Weight For Jiu JItsu?,10000.0,https://www.youtube.com/watch?v=GJVZyjH5NjA
216,How To Defend That Cross Choke!,10000.0,https://www.youtube.com/watch?v=HLbiPKJdkbA
49,Easy Submissions From The Back,10000.0,https://www.youtube.com/watch?v=HjT2WlABfyU
117,Surprise Armbar - From Side Control,10000.0,https://www.youtube.com/watch?v=9o6QG69EVQQ
86,How To Attack The Turtle Position,10000.0,https://www.youtube.com/watch?v=a70806ofHUY
114,The Awesome Clock Choke,10000.0,https://www.youtube.com/watch?v=Yh7jsmFc4xg
105,Underhooks and Overhooks   The Basics,10000.0,https://www.youtube.com/watch?v=dLAhTM1zgjw
425,An AWESOME Lapel HACK To Escape Being Pinned by a HEAVY GUY!,10000.0,https://www.youtube.com/watch?v=t9ZZoim4vss
83,Rolling Back Take,10000.0,https://www.youtube.com/watch?v=eH4s3yOb3WU
157,Back Step Half Guard Pass!,10000.0,https://www.youtube.com/watch?v=ZWVg6dzdmP8
112,De La Riva Guard Sweep 2 of 3,10000.0,https://www.youtube.com/watch?v=imno_iO3zIs
159,The Cradle Series!,10000.0,https://www.youtube.com/watch?v=aCkFu2k4hok
68,Front Control Kimura Attack System,10000.0,https://www.youtube.com/watch?v=vjjohJ51XWA
501,The AWESOME AMERICANA from Mount!,10000.0,https://www.youtube.com/watch?v=ekbxnxGruWY
284,Ashi Garami Into A Powerful Footlock,10000.0,https://www.youtube.com/watch?v=59hN1vNz7VM
305,[IMPORTANT] How Hard Should You Roll With Different Belts/Experience?,10000.0,https://www.youtube.com/watch?v=YjIUgAPKq3k
499,HOW to Massively Improve your KIMURA POWER!,9900.0,https://www.youtube.com/watch?v=M8-wLGKgkWE
23,TROUBLE SHOOTING - Scissor Sweep - WORLD CLASS!,9800.0,https://www.youtube.com/watch?v=ZXs0VJJLBjI
530,An AWESOME SUBMISSION - The Kimura from Top Half Guard!,9800.0,https://www.youtube.com/watch?v=0w9skxDhdgs
174,Baratoplata Setups Number 3 (of 3),9700.0,https://www.youtube.com/watch?v=X2VX1wXRZzY
220,Blue Belt Blues,9600.0,https://www.youtube.com/watch?v=XDu2OeDTnsQ
88,Coach Tom Black Belt Grading From Coral Belt Carlos Machado,9600.0,https://www.youtube.com/watch?v=G8KYai39Hws
487,How to do the INVERTED GUARD TRIANGLE - The Easy Way!,9500.0,https://www.youtube.com/watch?v=sNEduRGAHkg
26,Wrist locks - All you need to know to BREAK that wrist!,9500.0,https://www.youtube.com/watch?v=fyvlUWhSMKw
110,How To Pull Guard In A Competition,9500.0,https://www.youtube.com/watch?v=H4e4JH2IJVw
122,The Crucifix Entry And Submission,9300.0,https://www.youtube.com/watch?v=ytov2iyHHh0
401,How to Add Crazy Pressure To Your Mount!,9300.0,https://www.youtube.com/watch?v=r5JzA53twNE
495,How to do the Cross Face - New and Better!,9200.0,https://www.youtube.com/watch?v=YFBjbefPM58
56,Awesome Back Take Finishes,9100.0,https://www.youtube.com/watch?v=K73-5B4rcWA
24,Arm Bar From The Back!,9000.0,https://www.youtube.com/watch?v=ntGjzwAiWMc
30,Some Awesome Footwork Drills - To Pass The Guard,8700.0,https://www.youtube.com/watch?v=wp_R7APOEpA
529,An AWESOME MOVE - Countering the Kimura from half guard with a BACK TAKE!,8600.0,https://www.youtube.com/watch?v=_w7JP9VMyvk
161,Escape That Triangle!,8600.0,https://www.youtube.com/watch?v=CF9P74djqXM
206,The Spin Under Armbar!,8500.0,https://www.youtube.com/watch?v=28r1tkKRe5U
89,Easy Escape From Side Control,8400.0,https://www.youtube.com/watch?v=PgHVUf3W424
516,SUPER Simple Guard Break - The Standing GUARD BREAK!,8300.0,https://www.youtube.com/watch?v=cKJQd8w4ZH4
223,Back Submission  The Arm In Ezekiel,8300.0,https://www.youtube.com/watch?v=cgdlRm9_2kI
486,The AWESOME Low Single TAKEDOWN!,8200.0,https://www.youtube.com/watch?v=vywNM4rdHSs
237,How To Defend Against Toe Holds,8200.0,https://www.youtube.com/watch?v=f4OOg_35Xjk
52,Top 3 Moves For Lanky Athletes!,8100.0,https://www.youtube.com/watch?v=hE1dM0apf8M
69,Butterfly Sweep & Guillotine Choke Combo,8100.0,https://www.youtube.com/watch?v=VHLZZ1avVcY
238,How To Stop People Breaking Open Your Guard,8100.0,https://www.youtube.com/watch?v=riLpR-qDDdk
169,An Awesome Entry Into A Guillotine Choke,8000.0,https://www.youtube.com/watch?v=8V5aa-wBpVo
118,Stopping Stiff Arms,7700.0,https://www.youtube.com/watch?v=Uu1yQ0N0mnI
111,De La Riva Guard Sweep 3 of 3,7600.0,https://www.youtube.com/watch?v=S3IJyVkr5dg
308,The Cheating Scissor Sweep,7600.0,https://www.youtube.com/watch?v=kkylIiGaTkY
467,Jean Machado - Get the KIMURA Or Switch into an Omoplata!,7500.0,https://www.youtube.com/watch?v=HVm1Almjdg0
63,The (Darth) Fader Escape,7400.0,https://www.youtube.com/watch?v=g1jkJLXJyUI
108,A Tricky Half Guard Sweep!,7400.0,https://www.youtube.com/watch?v=RYGO1PS2WTo
494,How to ESCAPE North South & Finish with a TRIANGLE!,7400.0,https://www.youtube.com/watch?v=jjo25PmXZpo
33,"Self Defence, The Basics!",7300.0,https://www.youtube.com/watch?v=6Jnf6kItGDI
32,Thinking About Competing In BJJ?,7300.0,https://www.youtube.com/watch?v=n6WXrw8fUOQ
198,A Super Easy And Effective Kimura From Guard,7200.0,https://www.youtube.com/watch?v=3B3OWCdu7yk
449,The BEST Way to CUT Weight!,7200.0,https://www.youtube.com/watch?v=lOI5YQh7zUs
147,Headlock Control Series!,7200.0,https://www.youtube.com/watch?v=ICNFqs8veFU
224,The 'Murder She Wrote' Triangle Finish,7200.0,https://www.youtube.com/watch?v=wzgvuVR_Vhg
252,Footlock - Do This To Get It Quick!,7100.0,https://www.youtube.com/watch?v=l_3Lst62TQc
461,Mount ESCAPE Straight Into A FOOTLOCK!,7000.0,https://www.youtube.com/watch?v=b_9e5erA4Dw
215,How To Escape Armbars!,6900.0,https://www.youtube.com/watch?v=_JTatDnG1mU
453,Totally LEGAL at Whitebelt - The Belly Down Footlock!,6900.0,https://www.youtube.com/watch?v=DS-BU7ml-QA
191,The Hip Bump Triangle!,6900.0,https://www.youtube.com/watch?v=1d5mCjj_XH4
94,White Belt Mistakes - Don't Be That Guy!,6800.0,https://www.youtube.com/watch?v=rTrqn-ys84o
76,Reverse Ashi Garami   Some Awesome Tips,6800.0,https://www.youtube.com/watch?v=0h--tl5Qbr0
310,Knee Slice Power Pass!,6700.0,https://www.youtube.com/watch?v=nE1KWbxkpec
507,How to SURVIVE a GUILLOTINE CHOKE!,6600.0,https://www.youtube.com/watch?v=GAyM-F8UbZY
339,Waiter Sweep From Deep Half!,6600.0,https://www.youtube.com/watch?v=uaSNBRaDlL8
390,The Knee Slice Pass Counter!,6600.0,https://www.youtube.com/watch?v=hVZRchXbelo
149,Cradle Attack Series - One Arm Anaconda!,6500.0,https://www.youtube.com/watch?v=uShejdY5aII
8,How To Grapple Against A Much Bigger Opponent! Part. 1,6500.0,https://www.youtube.com/watch?v=BKDhWv_wPZg
130,Cross Choke Tips,6400.0,https://www.youtube.com/watch?v=RfZnmfEttrI
61,North South Into A Triangle,6400.0,https://www.youtube.com/watch?v=Euv1dbDRpuQ
99,Coach Tom - Competition Matches - At Worlds Vegas,6400.0,https://www.youtube.com/watch?v=ZOJppNkrC1o
21,TROUBLE SHOOTING - The Cross Choke!,6300.0,https://www.youtube.com/watch?v=g2QaZ4sFG5c
514,An AWESOME Way to GET the DARCE CHOKE - on a Bigger Opponent!,6300.0,https://www.youtube.com/watch?v=KAgggmo8VKU
101,Tricks and Hints To Finish The Ankle Lock,6300.0,https://www.youtube.com/watch?v=DHWFWcgsf0Y
462,A PENDULUM SWEEP To Arm Bar - A Tricky Variation!,6300.0,https://www.youtube.com/watch?v=VOYO359LuvU
230,Hip Bump Sweep!,6200.0,https://www.youtube.com/watch?v=e8X02WObsvg
465,How to footlock when your BACK IS TAKEN!,6200.0,https://www.youtube.com/watch?v=9IGA5U3WL7g
412,Omoplata From Half Guard - Using the Shoulder Sandwich!,6200.0,https://www.youtube.com/watch?v=ERrc3FQDo6w
211,Mount Survival And Escape Guide,6200.0,https://www.youtube.com/watch?v=AANM5boHwSg
177,De La Riva Counter   The Rigan Trap!,6200.0,https://www.youtube.com/watch?v=NuR4m3sIzy8
505,Combat Sweep - Transition to a CHOKE!,6100.0,https://www.youtube.com/watch?v=0sfxzrV1f74
199,Some Awesome Armbar Tips,6100.0,https://www.youtube.com/watch?v=SZ-si7MkbCc
502,A Simple SIDE Control to MOUNT Transition!,6000.0,https://www.youtube.com/watch?v=dcdFfxMTxA8
248,Guillotine Prevention With The Von Flue Choke,6000.0,https://www.youtube.com/watch?v=s-ofdmPDxo4
16,Professor Tom's favorite Solo Drills!,6000.0,https://www.youtube.com/watch?v=sShHD0GXf5U
312,The Standing Guard Break - What You Need To Know!,6000.0,https://www.youtube.com/watch?v=oA9giomzSto
107,The Estima Lock!,6000.0,https://www.youtube.com/watch?v=Bvhe_QSonIs
131,Escape Back Control And Get Side Control,5900.0,https://www.youtube.com/watch?v=PqxERevTEFo
115,Killer Backtake When Your Partner Is In Turtle,5800.0,https://www.youtube.com/watch?v=ESrphQwHuvo
251,An Awesome Kesa Gatame - With Americana Submission,5800.0,https://www.youtube.com/watch?v=66ETvhhBfmU
360,The Kimura!,5700.0,https://www.youtube.com/watch?v=_6p38M-sUBk
179,Stop And Counter The Scissor Sweep,5700.0,https://www.youtube.com/watch?v=mRFVO1DOD5Y
154,3 White Belts Mistakes To Avoid. So You Don't Get Tapped,5600.0,https://www.youtube.com/watch?v=Q-EqspkdQDk
73,Prof Tom Davey - Houston International Open 2019,5600.0,https://www.youtube.com/watch?v=7md9fPcd1mk
62,The 50/ 50 Position,5600.0,https://www.youtube.com/watch?v=ogefeZ72vlk
227,Front Sweep Helicopter Armbar,5500.0,https://www.youtube.com/watch?v=A8YFn2ZpfZE
350,Mount Escapes To Ashi Garami!,5500.0,https://www.youtube.com/watch?v=2r7Ypg1pHtI
455,The Brilliant PILLOW Defence!,5500.0,https://www.youtube.com/watch?v=AAN8VXCtl0Y
79,Transform Those Kimura's,5500.0,https://www.youtube.com/watch?v=sAk1Y06WFPE
195,A Very Cheeky Horrible Submission,5400.0,https://www.youtube.com/watch?v=pq-RCw7bqbc
476,Prof John Machado - TWO WAYS to PASS the Half Guard!,5400.0,https://www.youtube.com/watch?v=aizMaLbPEv4
